,ticker,sector,full name,marketCap,fullTimeEmployees,longBusinessSummary,country,website,returnOnEquity,revenuePerShare,bookValue,yield,beta
16,MMM,Industry,3M Company,84705558528.0,95000.0,"3M Company operates as a diversified technology company worldwide. It operates through four segments: Safety and Industrial; Transportation and Electronics; Health Care; and Consumer. The Safety and Industrial segment offers industrial abrasives and finishing for metalworking applications; autobody repair solutions; closure systems for personal hygiene products, masking, and packaging materials; electrical products and materials for construction and maintenance, power distribution, and electrical original equipment manufacturers; structural adhesives and tapes; respiratory, hearing, eye, and fall protection solutions; and natural and color-coated mineral granules for shingles. The Transportation and Electronics segment provides ceramic solutions; attachment tapes, films, sound, and temperature management for transportation vehicles; premium large format graphic films for advertising and fleet signage; light management films and electronics assembly solutions; packaging and interconnection solutions; and reflective signage for highway, and vehicle safety. The Healthcare segment offers food safety indicator solutions; health care procedure coding and reimbursement software; skin, wound care, and infection prevention products and solutions; dentistry and orthodontia solutions; and filtration and purification systems. The Consumer segment provides consumer bandages, braces, supports and consumer respirators; cleaning products for the home; retail abrasives, paint accessories, car care DIY products, picture hanging, and consumer air quality solutions; and stationery products. It offers its products through e-commerce and traditional wholesalers, retailers, jobbers, distributors, and dealers. The company was founded in 1902 and is based in St. Paul, Minnesota.",United States,https://www.3m.com,0.42278,61.062,26.311,,0.969488
17,NLSN,Industry,Nielsen Holdings plc,8785813504.0,14000.0,"Nielsen Holdings plc, together with its subsidiaries, operates as a measurement and data analytics company worldwide. The company provides viewership and listening data, and analytics principally to media publishers and marketers, and advertising agencies for television, computer, mobile, CTV, digital, and listening platforms. It also offers television audience measurement services; digital audience measurement services; video advertising services; and independent measurement and consumer research primarily servicing radio, advertisers, and advertising agencies in the audio industry. In addition, it offers consumer behavioral and transactional data. Nielsen Holdings plc provides marketing solutions. The company was founded in 1923 and is headquartered in New York, New York.",United States,https://www.nielsen.com,0.19481,9.759,9.224,,1.405511
18,RHI,Industry,Robert Half International Inc.,13321060352.0,14600.0,"Robert Half International Inc. provides staffing and risk consulting services in North America, South America, Europe, Asia, and Australia. The company operates through three segments: Temporary and Consultant Staffing, Permanent Placement Staffing, and Risk Consulting and Internal Audit Services. It places temporary services for accounting, finance, and bookkeeping; temporary and full-time office and administrative personnel consisting of executive and administrative assistants, receptionists, and customer service representatives; full-time accounting, financial, tax, and accounting operations personnel; and information technology contract professionals and full-time employees in the areas of platform systems integration to end-user technical and desktop support, including specialists in application development, networking and cloud, systems integration and deployment, database design and administration, and security and business continuity. The company also offers temporary and full-time employees in attorney, paralegal, legal administrative, and legal secretarial positions; and senior-level project professionals in the accounting and finance fields for financial systems conversions, expansion into new markets, business process re-engineering, business systems performance improvement, and post-merger financial consolidation. It is involved in serving professionals in the areas of creative, design, marketing, advertising, and public relations; and placing various positions, such as creative directors, graphics designers, web designers, media buyers, front end developers, copywriters, digital marketing managers, marketing analytics specialists, brand managers, and public relations specialists. The company provides internal audit, technology consulting, risk and compliance consulting, and business performance services. It serves clients and employment candidates. Robert Half International Inc. was founded in 1948 and is headquartered in Menlo Park, California.",United States,https://www.roberthalf.com,0.46291,58.484,12.678,,1.459153
19,UPS,Industry,"United Parcel Service, Inc.",175445098496.0,267890.0,"United Parcel Service, Inc. provides letter and package delivery, transportation, logistics, and related services. It operates through two segments, U.S. Domestic Package and International Package. The U.S. Domestic Package segment offers time-definite delivery of letters, documents, small packages, and palletized freight through air and ground services in the United States. The International Package segment provides guaranteed day and time-definite international shipping services in Europe, the Asia Pacific, Canada and Latin America, the Indian sub-continent, the Middle East, and Africa. This segment offers guaranteed time-definite express options. The company also provides international air and ocean freight forwarding, customs brokerage, distribution and post-sales, and mail and consulting services in approximately 200 countries and territories. In addition, it offers truckload brokerage services; supply chain solutions to the healthcare and life sciences industry; shipping, visibility, and billing technologies; and financial and insurance services. The company operates a fleet of approximately 121,000 package cars, vans, tractors, and motorcycles; and owns 59,000 containers that are used to transport cargo in its aircraft. United Parcel Service, Inc. was founded in 1907 and is headquartered in Atlanta, Georgia.",United States,https://www.ups.com,1.7258,111.312,16.383,,1.117618
20,MPC,Energy,Marathon Petroleum Corporation,45047865344.0,17700.0,"Marathon Petroleum Corporation, together with its subsidiaries, operates as an integrated downstream energy company primarily in the United States. It operates in two segments: Refining & Marketing, and Midstream. The Refining & Marketing segment refines crude oil and other feedstocks at its refineries in the Gulf Coast, Mid-Continent, and West Coast regions of the United States; and purchases refined products and ethanol for resale. Its refined products include transportation fuels, such as reformulated gasolines and blend-grade gasolines; heavy fuel oil; and asphalt. This segment also manufactures aromatics, propane, propylene, and sulfur. It sells refined products to wholesale marketing customers in the United States and internationally, buyers on the spot market, and independent entrepreneurs who operate primarily Marathon branded outlets; and through long-term fuel supply contracts to direct dealer locations primarily under the ARCO brand. The Midstream segment transports, stores, distributes, and markets crude oil and refined products through refining logistics assets, pipelines, terminals, towboats, and barges; gathers, processes, and transports natural gas; and gathers, transports, fractionates, stores, and markets natural gas liquids. It also owns and operates crude oil, natural gas, and refined product pipelines. As of December 31, 2021, the company operated 7,159 brand jobber outlets in 37 states, the District of Columbia, and Mexico through independent entrepreneurs. Petroleum Corporation was founded in 1887 and is headquartered in Findlay, Ohio.",United States,https://www.marathonpetroleum.com,0.08003,189.986,45.261,,1.901574
21,CLR,Energy,"Continental Resources, Inc.",22289037312.0,1254.0,"Continental Resources, Inc. explores for, develops, produces, and manages crude oil, natural gas, and related products primarily in the north, south, and east regions of the United States. The company sells its crude oil and natural gas production to energy marketing companies, crude oil refining companies, and natural gas gathering and processing companies. As of December 31, 2021, its proved reserves were 1,645 million barrels of crude oil equivalent (MMBoe) with proved developed reserves of 908 MMBoe. The company was founded in 1967 and is headquartered in Oklahoma City, Oklahoma.",United States,https://www.clr.com,0.23341,15.104,20.858,,2.903051
22,HFC,Energy,HF Sinclair Corporation,5931642880.0,4208.0,"HollyFrontier Corporation operates as an independent petroleum refiner and marketer in the United States. The company operates through three segments: Refining, Lubricants and Specialty Products, and HEP. It primarily produces high-value light products, such as gasoline, diesel and jet fuel, and specialty lubricant products, as well as specialty and modified asphalt. The company offers its products to other refiners, convenience store chains, independent marketers, liquid petroleum gases and other retailers, truck stop chains, wholesalers, railroads, governmental entities, and paving contractors or manufacturers, as well as for commercial airline use. It owns and operates five refineries with a combined crude oil processing capacity of approximately 554,000 barrels per day in El Dorado, Kansas; Tulsa, Oklahoma; Anacortes, Washington; Artesia, New Mexico; and Woods Cross, Utah. The company also owns and operates vacuum distillation and other facilities in Lovington, New Mexico, as well as asphalt terminals in Arizona, New Mexico, and Oklahoma. Its refineries serve markets in the Mid-Continent, Southwest, and Rocky Mountain regions of the United States. In addition, the company produces base oils and other specialized lubricant products; and owns and operates logistic assets consisting of petroleum product and crude oil pipelines, terminals, tankage, loading rack facilities, and refinery processing units. The company was formerly known as Holly Corporation and changed its name to HollyFrontier Corporation as a result of its merger with Frontier Oil Corporation in July 2011. HollyFrontier Corporation was incorporated in 1947 and is headquartered in Dallas, Texas.",United States,https://www.hollyfrontier.com,0.11038999,113.116,35.242,,1.592027
23,MRO,Energy,Marathon Oil Corporation,16939173888.0,1531.0,"Marathon Oil Corporation operates as an independent exploration and production company in the United States and internationally. The company engages in the exploration, production, and marketing of crude oil and condensate, natural gas liquids, and natural gas; and the production and marketing of products manufactured from natural gas, such as liquefied natural gas and methanol. It also owns and operates 32 central gathering and treating facilities; and the Sugarloaf gathering system, a 42-mile natural gas pipeline through Karnes and Atascosa Counties. The company was formerly known as USX Corporation and changed its name to Marathon Oil Corporation in December 2001. Marathon Oil Corporation was founded in 1887 and is headquartered in Houston, Texas.",United States,https://www.marathonoil.com,0.089049995,7.136,14.381,,2.764271
24,PXD,Energy,Pioneer Natural Resources Company,58258157568.0,1932.0,"Pioneer Natural Resources Company operates as an independent oil and gas exploration and production company in the United States. The company explores for, develops, and produces oil, natural gas liquids (NGLs), and gas. It has operations in the Midland Basin in West Texas. As of December 31, 2021, the company had proved undeveloped reserves and proved developed non-producing reserves of 130 million barrels of oil, 92 million barrels of NGLs, and 462 billion cubic feet of gas; and owned interests in 11 gas processing plants. Pioneer Natural Resources Company was founded in 1997 and is headquartered in Irving, Texas.",United States,https://www.pxd.com,0.12312,76.695,94.065,,1.609744
25,TRGP,Energy,Targa Resources Corp.,16051697664.0,2430.0,"Targa Resources Corp., together with its subsidiary, Targa Resources Partners LP, owns, operates, acquires, and develops a portfolio of midstream energy assets in North America. It operates in two segments, Gathering and Processing, and Logistics and Transportation. The company engages in gathering, compressing, treating, processing, transporting, and selling natural gas; storing, fractionating, treating, transporting, and selling natural gas liquids (NGL) and NGL products, including services to liquefied petroleum gas exporters; and gathering, purchasing, storing, terminaling, and selling crude oil. It is also involved in the purchase and resale of NGL products; and wholesale of propane, as well as provision of related logistics services to multi-state retailers, independent retailers, and other end-users. In addition, the company offers NGL balancing services; and transportation services to refineries and petrochemical companies in the Gulf Coast area, as well as purchases, markets, and resells natural gas. It operates approximately 28,400 miles of natural gas pipelines, including 42 owned and operated processing plants; and owns or operates a total of 34 storage wells with a gross storage capacity of approximately 76 million barrels. As of December 31, 2021, the company leased and managed approximately 648 railcars; 119 transport tractors; and two company-owned pressurized NGL barges. Targa Resources Corp. was incorporated in 2005 and is headquartered in Houston, Texas.",United States,https://www.targaresources.com,0.06958,74.146,8.815,,2.638779
26,DVN,Energy,Devon Energy Corporation,39456538624.0,1600.0,"Devon Energy Corporation, an independent energy company, primarily engages in the exploration, development, and production of oil, natural gas, and natural gas liquids in the United States. It operates approximately 5,134 gross wells. Devon Energy Corporation was incorporated in 1971 and is headquartered in Oklahoma City, Oklahoma.",United States,https://www.devonenergy.com,0.45626998,19.784,13.97,,2.80807
27,NEE,Energy,"NextEra Energy, Inc.",161670889472.0,15000.0,"NextEra Energy, Inc., through its subsidiaries, generates, transmits, distributes, and sells electric power to retail and wholesale customers in North America. The company generates electricity through wind, solar, nuclear, coal, and natural gas facilities. It also develops, constructs, and operates long-term contracted assets that consists of clean energy solutions, such as renewable generation facilities, battery storage projects, and electric transmission facilities; sells energy commodities; and owns, develops, constructs, manages and operates electric generation facilities in wholesale energy markets. As of December 31, 2021, the company had approximately 28,564 megawatts of net generating capacity; approximately 77,000 circuit miles of transmission and distribution lines; and 696 substations. It serves approximately 11 million people through approximately 5.7 million customer accounts in the east and lower west coasts of Florida. The company was formerly known as FPL Group, Inc. and changed its name to NextEra Energy, Inc. in 2010. The company was founded in 1925 and is headquartered in Juno Beach, Florida.",United States,https://www.nexteraenergy.com,0.06241,8.698,18.952,,0.37746
28,EOG,Energy,"EOG Resources, Inc.",67788046336.0,2800.0,"EOG Resources, Inc., together with its subsidiaries, explores for, develops, produces, and markets crude oil, and natural gas and natural gas liquids. Its principal producing areas are in New Mexico and Texas in the United States; and the Republic of Trinidad and Tobago. As of December 31, 2021, it had total estimated net proved reserves of 3,747 million barrels of oil equivalent, including 1,548 million barrels (MMBbl) of crude oil and condensate reserves; 829 MMBbl of natural gas liquid reserves; and 8,222 billion cubic feet of natural gas reserves. The company was formerly known as Enron Oil & Gas Company. EOG Resources, Inc. was incorporated in 1985 and is headquartered in Houston, Texas.",United States,https://www.eogresources.com,0.21957001,34.04,37.897,,1.781496
29,XOM,Energy,Exxon Mobil Corporation,358105841664.0,63000.0,"Exxon Mobil Corporation explores for and produces crude oil and natural gas in the United States and internationally. It operates through Upstream, Downstream, and Chemical segments. The company is also involved in the manufacture, trade, transport, and sale of crude oil, natural gas, petroleum products, petrochemicals, and other specialty products; manufactures and sells petrochemicals, including olefins, polyolefins, aromatics, and various other petrochemicals; and captures and stores carbon, hydrogen, and biofuels. As of December 31, 2021, it had approximately 20,528 net operated wells with proved reserves. The company was founded in 1870 and is headquartered in Irving, Texas.",United States,https://corporate.exxonmobil.com,0.13889,65.259,39.768,,1.151082
30,JPM,Financial,JPMorgan Chase & Co.,413688692736.0,271025.0,"JPMorgan Chase & Co. operates as a financial services company worldwide. It operates through four segments: Consumer & Community Banking (CCB), Corporate & Investment Bank (CIB), Commercial Banking (CB), and Asset & Wealth Management (AWM). The CCB segment offers s deposit, investment and lending products, payments, and services to consumers; lending, deposit, and cash management and payment solutions to small businesses; mortgage origination and servicing activities; residential mortgages and home equity loans; and credit card, auto loan, and leasing services. The CIB segment provides investment banking products and services, including corporate strategy and structure advisory, and equity and debt markets capital-raising services, as well as loan origination and syndication; payments and cross-border financing; and cash and derivative instruments, risk management solutions, prime brokerage, and research. This segment also offers securities services, including custody, fund accounting and administration, and securities lending products for asset managers, insurance companies, and public and private investment funds. The CB segment provides financial solutions, including lending, payments, investment banking, and asset management to small business, large and midsized companies, local governments, and nonprofit clients; and commercial real estate banking services to investors, developers, and owners of multifamily, office, retail, industrial, and affordable housing properties. The AWM segment offers multi-asset investment management solutions in equities, fixed income, alternatives, and money market funds to institutional clients and retail investors; and retirement products and services, brokerage, custody, trusts and estates, loans, mortgages, deposits, and investment management products. The company also provides ATM, online and mobile, and telephone banking services. JPMorgan Chase & Co. was founded in 1799 and is headquartered in New York, New York.",United States,https://www.jpmorganchase.com,0.16856001,43.322,88.069,,1.112204
31,V,Financial,Visa Inc.,425984884736.0,21500.0,"Visa Inc. operates as a payments technology company worldwide. The company facilitates digital payments among consumers, merchants, financial institutions, businesses, strategic partners, and government entities. It operates VisaNet, a transaction processing network that enables authorization, clearing, and settlement of payment transactions. In addition, the company offers card products, platforms, and value-added services. It provides its services under the Visa, Visa Electron, Interlink, VPAY, and PLUS brands. Visa Inc. was founded in 1958 and is headquartered in San Francisco, California.",United States,https://usa.visa.com,0.35584998,12.01,15.82,,0.92372
32,MA,Financial,Mastercard Incorporated,339492438016.0,24000.0,"Mastercard Incorporated, a technology company, provides transaction processing and other payment-related products and services in the United States and internationally. It facilitates the processing of payment transactions, including authorization, clearing, and settlement, as well as delivers other payment-related products and services. The company offers integrated products and value-added services for account holders, merchants, financial institutions, businesses, governments, and other organizations, such as programs that enable issuers to provide consumers with credits to defer payments; prepaid programs and management services; commercial credit and debit payment products and solutions; and payment products and solutions that allow its customers to access funds in deposit and other accounts. It also provides value-added products and services comprising cyber and intelligence solutions for parties to transact, as well as proprietary insights, drawing on principled use of consumer, and merchant data services. In addition, the company offers analytics, test and learn, consulting, managed services, loyalty, processing, and payment gateway solutions for e-commerce merchants. Further, it provides open banking and digital identity platforms services. The company offers payment solutions and services under the MasterCard, Maestro, and Cirrus. Mastercard Incorporated was founded in 1966 and is headquartered in Purchase, New York.",United States,https://www.mastercard.com,1.2473301,19.113,7.462,,1.088582
33,C,Financial,Citigroup Inc.,113604034560.0,220092.0,"Citigroup Inc., a diversified financial services holding company, provides various financial products and services to consumers, corporations, governments, and institutions in North America, Latin America, Asia, Europe, the Middle East, and Africa. The company operates in two segments, Global Consumer Banking (GCB) and Institutional Clients Group (ICG). The GCB segment offers traditional banking services to retail customers through retail banking, Citi-branded cards, and Citi retail services. It also provides various banking, credit card, lending, and investment services through a network of local branches, offices, and electronic delivery systems. The ICG segment offers wholesale banking products and services, including fixed income and equity sales and trading, foreign exchange, prime brokerage, derivative, equity and fixed income research, corporate lending, investment banking and advisory, private banking, cash management, trade finance, and securities services to corporate, institutional, public sector, and high-net-worth clients. As of December 31, 2021, it operated 2,154 branches primarily in the United States, Mexico, and Asia. Citigroup Inc. was founded in 1812 and is headquartered in New York, New York.",United States,https://www.citigroup.com,0.10931,36.886,92.21,,1.694881
34,BAC,Financial,Bank of America Corporation,345982500864.0,208000.0,"Bank of America Corporation, through its subsidiaries, provides banking and financial products and services for individual consumers, small and middle-market businesses, institutional investors, large corporations, and governments worldwide. Its Consumer Banking segment offers traditional and money market savings accounts, certificates of deposit and IRAs, noninterest-and interest-bearing checking accounts, and investment accounts and products; and credit and debit cards, residential mortgages, and home equity loans, as well as direct and indirect loans, such as automotive, recreational vehicle, and consumer personal loans. The company's Global Wealth & Investment Management segment offers investment management, brokerage, banking, and trust and retirement products and services; and wealth management solutions, as well as customized solutions, including specialty asset management services. Its Global Banking segment provides lending products and services, including commercial loans, leases, commitment facilities, trade finance, and commercial real estate and asset-based lending; treasury solutions, such as treasury management, foreign exchange, and short-term investing options and merchant services; working capital management solutions; and debt and equity underwriting and distribution, and merger-related and other advisory services. The company's Global Markets segment offers market-making, financing, securities clearing, settlement, and custody services, as well as risk management products using interest rate, equity, credit, currency and commodity derivatives, foreign exchange, fixed-income, and mortgage-related products. As of December 31, 2021, it served approximately 67 million consumer and small business clients with approximately 4,200 retail financial centers; approximately 16,000 ATMs; and digital banking platforms with approximately 41 million active users. The company was incorporated in 1998 and is based in Charlotte, North Carolina.",United States,https://www.bankofamerica.com,0.11778,11.033,30.374,,1.415846
