,ticker,sector,full name,marketCap,fullTimeEmployees,longBusinessSummary,country,website,returnOnEquity,revenuePerShare,bookValue,yield,beta
35,WFC,Financial,Wells Fargo & Company,196144660480.0,247848.0,"Wells Fargo & Company, a diversified financial services company, provides banking, investment, mortgage, and consumer and commercial finance products and services in the United States and internationally. It operates through four segments: Consumer Banking and Lending; Commercial Banking; Corporate and Investment Banking; and Wealth and Investment Management. The Consumer Banking and Lending segment offers diversified financial products and services for consumers and small businesses. Its financial products and services include checking and savings accounts, and credit and debit cards, as well as home, auto, personal, and small business lending services. The Commercial Banking segment provides financial solutions to private, family owned, and certain public companies. Its products and services include banking and credit products across various industry sectors and municipalities, secured lending and lease products, and treasury management services. The Corporate and Investment Banking segment offers a suite of capital markets, banking, and financial products and services to corporate, commercial real estate, government, and institutional clients. Its products and services comprise corporate banking, investment banking, treasury management, commercial real estate lending and servicing, equity, and fixed income solutions, as well as sales, trading, and research capabilities services. The Wealth and Investment Management segment provides personalized wealth management, brokerage, financial planning, lending, private banking, and trust and fiduciary products and services to affluent, high-net worth, and ultra-high-net worth clients. It also operates through financial advisors. Wells Fargo & Company was founded in 1852 and is headquartered in San Francisco, California.",United States,https://www.wellsfargo.com,0.12366,20.421,43.285,,1.178149
36,SCHW,Financial,The Charles Schwab Corporation,163315810304.0,33400.0,"The Charles Schwab Corporation, together with its subsidiaries, provides wealth management, securities brokerage, banking, asset management, custody, and financial advisory services. The company operates in two segments, Investor Services and Advisor Services. The Investor Services segment provides retail brokerage, investment advisory, banking and trust, retirement plan, and other corporate brokerage services; equity compensation plan sponsors full-service recordkeeping for stock plans, stock options, restricted stock, performance shares, and stock appreciation rights; and retail investor and mutual fund clearing services, as well as compliance solutions. The Advisor Services segment offers custodial, trading, banking, and support services; and retirement business and corporate brokerage retirement services. This segment provides brokerage accounts with equity and fixed income, margin lending, options, and futures and forex trading; cash management capabilities comprising third-party certificates of deposit; third-party and proprietary mutual funds; plus mutual fund trading and clearing services; and exchange-traded funds (ETFs), including proprietary and third-party ETFs. It also offers advice solutions, such as managed portfolios of proprietary and third-party mutual funds and ETFs, separately managed accounts, customized personal advice for tailored portfolios, and specialized planning and portfolio management. In addition, this segment provides banking products and services, including checking and savings accounts, first lien residential real estate mortgage loans, home equity lines of credit, and pledged asset lines; and trust services comprising trust custody services, personal trust reporting services, and administrative trustee services. As of December 31, 2021, the Company had approximately 400 domestic branch offices in 48 states and the District of Columbia, as well as locations in Puerto Rico, the United Kingdom, Hong Kong, and Singapore. The Charles Schwab Corporation was incorporated in 1971 and is headquartered in Westlake, Texas.",United States,https://www.schwab.com,0.10425,9.815,24.459,,1.005905
37,MET,Financial,"MetLife, Inc.",56476585984.0,,"MetLife, Inc., a financial services company, provides insurance, annuities, employee benefits, and asset management services worldwide. It operates through five segments: U.S.; Asia; Latin America; Europe, the Middle East and Africa; and MetLife Holdings. The company offers life, dental, group short-and long-term disability, individual disability, pet insurance, accidental death and dismemberment, vision, and accident and health coverages, as well as prepaid legal plans; administrative services-only arrangements to employers; and general and separate account, and synthetic guaranteed interest contracts, as well as private floating rate funding agreements. It also provides pension risk transfers, institutional income annuities, structured settlements, and capital markets investment products; and other products and services, such as life insurance products and funding agreements for funding postretirement benefits, as well as company, bank, or trust-owned life insurance used to finance nonqualified benefit programs for executives. In addition, it provides fixed, indexed-linked, and variable annuities; and pension products; regular savings products; whole and term life, endowments, universal and variable life, and group life products; longevity reinsurance solutions; credit insurance products; and protection against long-term health care services. MetLife, Inc. was founded in 1863 and is headquartered in New York, New York.",United States,https://www.metlife.com,0.09224,82.392,81.743,,1.182578
38,BLK,Financial,"BlackRock, Inc.",112296706048.0,18400.0,"BlackRock, Inc. is a publicly owned investment manager. The firm primarily provides its services to institutional, intermediary, and individual investors including corporate, public, union, and industry pension plans, insurance companies, third-party mutual funds, endowments, public institutions, governments, foundations, charities, sovereign wealth funds, corporations, official institutions, and banks. It also provides global risk management and advisory services. The firm manages separate client-focused equity, fixed income, and balanced portfolios. It also launches and manages open-end and closed-end mutual funds, offshore funds, unit trusts, and alternative investment vehicles including structured funds. The firm launches equity, fixed income, balanced, and real estate mutual funds. It also launches equity, fixed income, balanced, currency, commodity, and multi-asset exchange traded funds. The firm also launches and manages hedge funds. It invests in the public equity, fixed income, real estate, currency, commodity, and alternative markets across the globe. The firm primarily invests in growth and value stocks of small-cap, mid-cap, SMID-cap, large-cap, and multi-cap companies. It also invests in dividend-paying equity securities. The firm invests in investment grade municipal securities, government securities including securities issued or guaranteed by a government or a government agency or instrumentality, corporate bonds, and asset-backed and mortgage-backed securities. It employs fundamental and quantitative analysis with a focus on bottom-up and top-down approach to make its investments. The firm employs liquidity, asset allocation, balanced, real estate, and alternative strategies to make its investments. In real estate sector, it seeks to invest in Poland and Germany. The firm benchmarks the performance of its portfolios against various S&P, Russell, Barclays, MSCI, Citigroup, and Merrill Lynch indices. BlackRock, Inc. was founded in 1988 and is based in New York City with additional offices in Boston, Massachusetts; London, United Kingdom; Gurgaon, India; Hong Kong; Greenwich, Connecticut; Princeton, New Jersey; Edinburgh, United Kingdom; Sydney, Australia; Taipei, Taiwan; Singapore; Sao Paulo, Brazil; Philadelphia, Pennsylvania; Washington, District of Columbia; Toronto, Canada; Wilmington, Delaware; and San Francisco, California.",United States,https://www.blackrock.com,0.16212,127.263,248.496,,1.236712
39,RY,Financial,Royal Bank of Canada,159908069376.0,85211.0,"Royal Bank of Canada operates as a diversified financial service company worldwide. The company's Personal & Commercial Banking segment offers checking and savings accounts, home equity financing, personal lending, private banking, indirect lending, including auto financing, mutual funds and self-directed brokerage accounts, guaranteed investment certificates, credit cards, and payment products and solutions; and lending, leasing, deposit, investment, foreign exchange, cash management, auto dealer financing, trade products, and services to small and medium-sized commercial businesses. This segment offers financial products and services through branches, automated teller machines, and mobile sales network. Its Wealth Management segment provides a suite of advice-based solutions and strategies to high net worth and ultra-high net worth individuals, and institutional clients. The company's Insurance segment offers life, health, home, auto, travel, wealth, annuities, and reinsurance advice and solutions; and business insurance services to individual, business, and group clients through its advice centers, RBC insurance stores, and mobile advisors; digital, mobile, and social platforms; independent brokers; and travel partners. Its Investor & Treasury Services segment provides asset servicing, custody, payments, and treasury services to financial and other investors; and fund and investment administration, shareholder, private capital, performance measurement and compliance monitoring, distribution, transaction banking, cash and liquidity management, foreign exchange, and global securities finance services. The company's Capital Markets segment offers corporate and investment banking, as well as equity and debt origination, distribution, advisory services, sale, and trading services for corporations, institutional investors, asset managers, private equity firms, and governments. The company was founded in 1864 and is headquartered in Toronto, Canada.",Canada,https://www.rbc.com,0.16954,35.517,66.714,,0.784939
40,SPY,ETF,SPDR S&P 500 ETF Trust,,,"The Trust seeks to achieve its investment objective by holding a portfolio of the common stocks that are included in the index (the Portfolio), with the weight of each stock in the Portfolio substantially corresponding to the weight of such stock in the index.",,,,,,0.012999999,
41,VOO,ETF,Vanguard S&P 500 ETF,,,"The investment seeks to track the performance of the Standard & Poors 500 Index that measures the investment return of large-capitalization stocks.
 The fund employs an indexing investment approach designed to track the performance of the Standard & Poor&#39;s 500 Index, a widely recognized benchmark of U.S. stock market performance that is dominated by the stocks of large U.S. companies. The advisor attempts to replicate the target index by investing all, or substantially all, of its assets in the stocks that make up the index, holding each stock in approximately the same proportion as its weighting in the index.",,,,,,0.0134000005,
42,QQQ,ETF,Invesco QQQ Trust,,,"The investment seeks investment results that generally correspond to the price and yield performance of the NASDAQ-100 Index.
 To maintain the correspondence between the composition and weights of the securities in the trust (the ""securities"") and the stocks in the NASDAQ-100 Index, the adviser adjusts the securities from time to time to conform to periodic changes in the identity and/or relative weights of index securities. The composition and weighting of the securities portion of a portfolio deposit are also adjusted to conform to changes in the index.",,,,,,0.0046,
43,GLD,ETF,SPDR Gold Shares,,,"The investment seeks to reflect the performance of the price of gold bullion, less the expenses of the Trusts operations.
 The Trust holds gold bars and from time to time, issues Baskets in exchange for deposits of gold and distributes gold in connection with redemptions of Baskets. The investment objective of the Trust is for the Shares to reflect the performance of the price of gold bullion, less the Trusts expenses. The Sponsor believes that, for many investors, the Shares represent a cost-effective investment in gold.",,,,,,0.0,
44,XLF,ETF,Financial Select Sector SPDR Fund,,,"The investment seeks investment results that, before expenses, correspond generally to the price and yield performance of publicly traded equity securities of companies in the Financial Select Sector Index.
 The fund generally invests substantially all, but at least 95%, of its total assets in the securities comprising the index. The index includes securities of companies from the following industries: diversified financial services; insurance; banks; capital markets; mortgage real estate investment trusts (""REITs""); consumer finance; and thrifts and mortgage finance. The fund is non-diversified.",,,,,,0.015700001,
45,VWO,ETF,Vanguard FTSE Emerging Markets Index Fund ETF Shares,,,"The investment seeks to track the performance of a benchmark index that measures the investment return of stocks issued by companies located in emerging market countries.
 The fund employs an indexing investment approach designed to track the performance of the FTSE Emerging Markets All Cap China A Inclusion Index. It invests by sampling the index, meaning that it holds a broadly diversified collection of securities that, in the aggregate, approximates the index in terms of key characteristics.",,,,,,0.0198,
46,XLU,ETF,Utilities Select Sector SPDR Fund,,,"The investment seeks to provide investment results that, before expenses, correspond generally to the price and yield performance of publicly traded equity securities of companies in the Utilities Select Sector Index.
 In seeking to track the performance of the index, the fund employs a replication strategy. It generally invests substantially all, but at least 95%, of its total assets in the securities comprising the index. The index includes securities of companies from the following industries: electric utilities; water utilities; multi-utilities; independent power and renewable electricity producers; and gas utilities. The fund is non-diversified.",,,,,,0.028800001,
47,XLV,ETF,The Select Sector SPDR Trust - The Health Care Select Sector SPDR Fund,,,"The investment seeks investment results that, before expenses, correspond generally to the price and yield performance of publicly traded equity securities of companies in the Health Care Select Sector Index.
 In seeking to track the performance of the index, the fund employs a replication strategy. It generally invests substantially all, but at least 95%, of its total assets in the securities comprising the index. The index includes companies from the following industries: pharmaceuticals; health care equipment & supplies; health care providers & services; biotechnology; life sciences tools & services; and health care technology. The fund is non-diversified.",,,,,,0.0139999995,
48,VEA,ETF,Vanguard FTSE Developed Markets Index Fund ETF Shares,,,"The investment seeks to track the performance of the FTSE Developed All Cap ex US Index.
 The fund employs an indexing investment approach designed to track the performance of the FTSE Developed All Cap ex US Index, a market-capitalization-weighted index that is made up of approximately 3865 common stocks of large-, mid-, and small-cap companies located in Canada and the major markets of Europe and the Pacific region. The adviser attempts to replicate the target index by investing all, or substantially all, of its assets in the stocks that make up the index, holding each stock in approximately the same proportion as its weighting in the index.",,,,,,0.0249,
49,VTV,ETF,Vanguard Value Index Fund ETF Shares,,,"The investment seeks to track the performance of the CRSP US Large Cap Value Index that measures the investment return of large-capitalization value stocks.
 The fund employs an indexing investment approach designed to track the performance of the CRSP US Large Cap Value Index, a broadly diversified index predominantly made up of value stocks of large U.S. companies. The advisor attempts to replicate the target index by investing all, or substantially all, of its assets in the stocks that make up the index, holding each stock in approximately the same proportion as its weighting in the index.",,,,,,0.0215,
